.config/miopen/gfx1100_48.HIP.3_1_0_261a49738-dirty.ufdb.txt
16-128-128-3x3-512-128-128-1-1x1-1x1-1x1-0-NCHW-FP32-F=ConvBinWinogradRxSf2x3g1:0.139201,0,miopenConvolutionFwdAlgoWinograd;ConvBinWinogradRxSf3x2:0.223201,0,miopenConvolutionFwdAlgoWinograd;GemmFwdRest:0.222522,9437184,miopenConvolutionFwdAlgoGEMM;ConvDirectNaiveConvFwd:16.3904,0,miopenConvolutionFwdAlgoDirect
512-128-128-3x3-512-128-128-1-1x1-1x1-1x1-0-NCHW-FP32-F=ConvBinWinogradRxSf2x3g1:1.19725,0,miopenConvolutionFwdAlgoWinograd;ConvBinWinogradRxSf3x2:2.47597,0,miopenConvolutionFwdAlgoWinograd;GemmFwdRest:3.64058,301989888,miopenConvolutionFwdAlgoGEMM;ConvDirectNaiveConvFwd:301.531,0,miopenConvolutionFwdAlgoDirect
512-128-128-1x1-512-128-128-1-0x0-1x1-1x1-0-NCHW-FP32-F=ConvBinWinogradRxSf2x3g1:1.23449,0,miopenConvolutionFwdAlgoWinograd;ConvBinWinogradRxSf3x2:0.586763,0,miopenConvolutionFwdAlgoWinograd;GemmFwd1x1_0_1:0.279961,0,miopenConvolutionFwdAlgoGEMM;ConvDirectNaiveConvFwd:39.637,0,miopenConvolutionFwdAlgoDirect
512-256-256-3x3-512-256-256-1-1x1-1x1-1x1-0-NCHW-FP32-F=ConvBinWinogradRxSf2x3g1:4.84151,0,miopenConvolutionFwdAlgoWinograd;ConvBinWinogradRxSf3x2:8.71513,0,miopenConvolutionFwdAlgoWinograd;GemmFwdRest:15.7174,1207959552,miopenConvolutionFwdAlgoGEMM;ConvDirectNaiveConvFwd:1203.52,0,miopenConvolutionFwdAlgoDirect
512-512-512-3x3-512-512-512-1-1x1-1x1-1x1-0-NCHW-FP32-F=ConvBinWinogradRxSf2x3g1:20.8484,0,miopenConvolutionFwdAlgoWinograd;ConvBinWinogradRxSf3x2:36.5773,0,miopenConvolutionFwdAlgoWinograd;GemmFwdRest:58.0863,4831838208,miopenConvolutionFwdAlgoGEMM;ConvDirectNaiveConvFwd:5140.09,0,miopenConvolutionFwdAlgoDirect
512-512-512-3x3-256-512-512-1-1x1-1x1-1x1-0-NCHW-FP32-F=ConvBinWinogradRxSf2x3g1:10.834,0,miopenConvolutionFwdAlgoWinograd;ConvBinWinogradRxSf3x2:18.54,0,miopenConvolutionFwdAlgoWinograd;GemmFwdRest:34.5353,4831838208,miopenConvolutionFwdAlgoGEMM;ConvDirectNaiveConvFwd:2900.96,0,miopenConvolutionFwdAlgoDirect
256-512-512-3x3-256-512-512-1-1x1-1x1-1x1-0-NCHW-FP32-F=ConvBinWinogradRxSf2x3g1:5.39871,0,miopenConvolutionFwdAlgoWinograd;ConvBinWinogradRxSf3x2:9.07305,0,miopenConvolutionFwdAlgoWinograd;GemmFwdRest:16.5056,2415919104,miopenConvolutionFwdAlgoGEMM;ConvDirectNaiveConvFwd:1587.04,0,miopenConvolutionFwdAlgoDirect
512-512-512-1x1-256-512-512-1-0x0-1x1-1x1-0-NCHW-FP32-F=ConvBinWinogradRxSf2x3g1:9.87457,0,miopenConvolutionFwdAlgoWinograd;ConvBinWinogradRxSf3x2:4.79563,0,miopenConvolutionFwdAlgoWinograd;GemmFwd1x1_0_1:3.17122,0,miopenConvolutionFwdAlgoGEMM;ConvDirectNaiveConvFwd:385.995,0,miopenConvolutionFwdAlgoDirect
256-1024-1024-3x3-256-1024-1024-1-1x1-1x1-1x1-0-NCHW-FP32-F=ConvBinWinogradRxSf2x3g1:21.204,0,miopenConvolutionFwdAlgoWinograd;ConvBinWinogradRxSf3x2:37.4345,0,miopenConvolutionFwdAlgoWinograd;ConvDirectNaiveConvFwd:5876.68,0,miopenConvolutionFwdAlgoDirect
256-1024-1024-3x3-128-1024-1024-1-1x1-1x1-1x1-0-NCHW-FP32-F=ConvBinWinogradRxSf2x3g1:10.5351,0,miopenConvolutionFwdAlgoWinograd;ConvBinWinogradRxSf3x2:18.898,0,miopenConvolutionFwdAlgoWinograd;ConvDirectNaiveConvFwd:3422,0,miopenConvolutionFwdAlgoDirect
128-1024-1024-3x3-128-1024-1024-1-1x1-1x1-1x1-0-NCHW-FP32-F=ConvBinWinogradRxSf2x3g1:5.70367,0,miopenConvolutionFwdAlgoWinograd;ConvBinWinogradRxSf3x2:9.24225,0,miopenConvolutionFwdAlgoWinograd;GemmFwdRest:21.3722,4831838208,miopenConvolutionFwdAlgoGEMM;ConvDirectNaiveConvFwd:1635.68,0,miopenConvolutionFwdAlgoDirect
256-1024-1024-1x1-128-1024-1024-1-0x0-1x1-1x1-0-NCHW-FP32-F=ConvBinWinogradRxSf2x3g1:10.2251,0,miopenConvolutionFwdAlgoWinograd;ConvBinWinogradRxSf3x2:5.37987,0,miopenConvolutionFwdAlgoWinograd;GemmFwd1x1_0_1:2.43105,0,miopenConvolutionFwdAlgoGEMM;ConvDirectNaiveConvFwd:404.092,0,miopenConvolutionFwdAlgoDirect
128-1024-1024-3x3-3-1024-1024-1-1x1-1x1-1x1-0-NCHW-FP32-F=ConvBinWinogradRxSf2x3g1:1.25857,0,miopenConvolutionFwdAlgoWinograd;ConvBinWinogradRxSf3x2:2.16157,0,miopenConvolutionFwdAlgoWinograd;GemmFwdRest:20.3126,4831838208,miopenConvolutionFwdAlgoGEMM;ConvDirectNaiveConvFwd:890.83,0,miopenConvolutionFwdAlgoDirect
16-180-180-3x3-512-180-180-1-1x1-1x1-1x1-0-NCHW-FP32-F=ConvBinWinogradRxSf2x3g1:0.13,0,miopenConvolutionFwdAlgoWinograd;ConvBinWinogradRxSf3x2:0.199881,0,miopenConvolutionFwdAlgoWinograd;GemmFwdRest:0.213281,18662400,miopenConvolutionFwdAlgoGEMM;ConvDirectNaiveConvFwd:27.0938,0,miopenConvolutionFwdAlgoDirect
512-180-180-3x3-512-180-180-1-1x1-1x1-1x1-0-NCHW-FP32-F=ConvBinWinogradRxSf2x3g1:2.97781,0,miopenConvolutionFwdAlgoWinograd;ConvBinWinogradRxSf3x2:4.1231,0,miopenConvolutionFwdAlgoWinograd;GemmFwdRest:7.36179,597196800,miopenConvolutionFwdAlgoGEMM;ConvDirectNaiveConvFwd:604.759,0,miopenConvolutionFwdAlgoDirect
512-180-180-1x1-512-180-180-1-0x0-1x1-1x1-0-NCHW-FP32-F=ConvBinWinogradRxSf2x3g1:2.47445,0,miopenConvolutionFwdAlgoWinograd;ConvBinWinogradRxSf3x2:1.25749,0,miopenConvolutionFwdAlgoWinograd;GemmFwd1x1_0_1:0.680603,0,miopenConvolutionFwdAlgoGEMM;ConvDirectNaiveConvFwd:80.1215,0,miopenConvolutionFwdAlgoDirect
512-360-360-3x3-512-360-360-1-1x1-1x1-1x1-0-NCHW-FP32-F=ConvBinWinogradRxSf2x3g1:10.0743,0,miopenConvolutionFwdAlgoWinograd;ConvBinWinogradRxSf3x2:17.3553,0,miopenConvolutionFwdAlgoWinograd;GemmFwdRest:28.1314,2388787200,miopenConvolutionFwdAlgoGEMM;ConvDirectNaiveConvFwd:2437.36,0,miopenConvolutionFwdAlgoDirect
512-720-720-3x3-512-720-720-1-1x1-1x1-1x1-0-NCHW-FP32-F=ConvBinWinogradRxSf2x3g1:40.2228,0,miopenConvolutionFwdAlgoWinograd;ConvBinWinogradRxSf3x2:72.0469,0,miopenConvolutionFwdAlgoWinograd;ConvDirectNaiveConvFwd:10266.2,0,miopenConvolutionFwdAlgoDirect
512-720-720-3x3-256-720-720-1-1x1-1x1-1x1-0-NCHW-FP32-F=ConvBinWinogradRxSf2x3g1:20.6915,0,miopenConvolutionFwdAlgoWinograd;ConvBinWinogradRxSf3x2:37.6165,0,miopenConvolutionFwdAlgoWinograd;ConvDirectNaiveConvFwd:6022.3,0,miopenConvolutionFwdAlgoDirect
256-720-720-3x3-256-720-720-1-1x1-1x1-1x1-0-NCHW-FP32-F=ConvBinWinogradRxSf2x3g1:10.4476,0,miopenConvolutionFwdAlgoWinograd;ConvBinWinogradRxSf3x2:17.7364,0,miopenConvolutionFwdAlgoWinograd;GemmFwdRest:33.7662,4777574400,miopenConvolutionFwdAlgoGEMM;ConvDirectNaiveConvFwd:2941.04,0,miopenConvolutionFwdAlgoDirect
512-720-720-1x1-256-720-720-1-0x0-1x1-1x1-0-NCHW-FP32-F=ConvBinWinogradRxSf2x3g1:19.5464,0,miopenConvolutionFwdAlgoWinograd;ConvBinWinogradRxSf3x2:9.67616,0,miopenConvolutionFwdAlgoWinograd;GemmFwd1x1_0_1:8.10864,0,miopenConvolutionFwdAlgoGEMM;ConvDirectNaiveConvFwd:784.7,0,miopenConvolutionFwdAlgoDirect
256-1440-1440-3x3-256-1440-1440-1-1x1-1x1-1x1-0-NCHW-FP32-F=ConvBinWinogradRxSf2x3g1:41.2616,0,miopenConvolutionFwdAlgoWinograd;ConvBinWinogradRxSf3x2:73.3955,0,miopenConvolutionFwdAlgoWinograd;ConvDirectNaiveConvFwd:12518.5,0,miopenConvolutionFwdAlgoDirect
256-1440-1440-3x3-128-1440-1440-1-1x1-1x1-1x1-0-NCHW-FP32-F=ConvBinWinogradRxSf2x3g1:21.3447,0,miopenConvolutionFwdAlgoWinograd;ConvBinWinogradRxSf3x2:41.4155,0,miopenConvolutionFwdAlgoWinograd;ConvDirectNaiveConvFwd:7217.51,0,miopenConvolutionFwdAlgoDirect
128-1440-1440-3x3-128-1440-1440-1-1x1-1x1-1x1-0-NCHW-FP32-F=ConvBinWinogradRxSf2x3g1:11.4483,0,miopenConvolutionFwdAlgoWinograd;ConvBinWinogradRxSf3x2:21.075,0,miopenConvolutionFwdAlgoWinograd;ConvDirectNaiveConvFwd:3511.4,0,miopenConvolutionFwdAlgoDirect
256-1440-1440-1x1-128-1440-1440-1-0x0-1x1-1x1-0-NCHW-FP32-F=ConvBinWinogradRxSf2x3g1:22.4633,0,miopenConvolutionFwdAlgoWinograd;ConvBinWinogradRxSf3x2:9.83552,0,miopenConvolutionFwdAlgoWinograd;GemmFwd1x1_0_1:18.6132,0,miopenConvolutionFwdAlgoGEMM;ConvDirectNaiveConvFwd:804.257,0,miopenConvolutionFwdAlgoDirect
128-1440-1440-3x3-3-1440-1440-1-1x1-1x1-1x1-0-NCHW-FP32-F=ConvBinWinogradRxSf2x3g1:3.49514,0,miopenConvolutionFwdAlgoWinograd;ConvBinWinogradRxSf3x2:4.17978,0,miopenConvolutionFwdAlgoWinograd;ConvDirectNaiveConvFwd:2063.87,0,miopenConvolutionFwdAlgoDirect
