.config/miopen/gfx1100_48.HIP.3_2_0_.ufdb.txt
16-128-128-3x3-512-128-128-1-1x1-1x1-1x1-0-NCHW-FP32-F=ConvBinWinogradRxSf2x3g1:0.1296,0,miopenConvolutionFwdAlgoWinograd;ConvBinWinogradRxSf3x2:0.207073,0,miopenConvolutionFwdAlgoWinograd;GemmFwdRest:0.224929,9437184,miopenConvolutionFwdAlgoGEMM;ConvDirectNaiveConvFwd:11.0367,0,miopenConvolutionFwdAlgoDirect
512-128-128-3x3-512-128-128-1-1x1-1x1-1x1-0-NCHW-FP32-F=ConvBinWinogradRxSf2x3g1:1.35839,0,miopenConvolutionFwdAlgoWinograd;ConvBinWinogradRxSf3x2:2.34463,0,miopenConvolutionFwdAlgoWinograd;GemmFwdRest:3.32531,301989888,miopenConvolutionFwdAlgoGEMM;ConvDirectNaiveConvFwd:361.483,0,miopenConvolutionFwdAlgoDirect
512-128-128-1x1-512-128-128-1-0x0-1x1-1x1-0-NCHW-FP32-F=ConvBinWinogradRxSf2x3g1:1.14962,0,miopenConvolutionFwdAlgoWinograd;ConvBinWinogradRxSf3x2:0.529026,0,miopenConvolutionFwdAlgoWinograd;GemmFwd1x1_0_1:0.327489,0,miopenConvolutionFwdAlgoGEMM;ConvDirectNaiveConvFwd:44.7414,0,miopenConvolutionFwdAlgoDirect
512-256-256-3x3-512-256-256-1-1x1-1x1-1x1-0-NCHW-FP32-F=ConvBinWinogradRxSf2x3g1:5.06493,0,miopenConvolutionFwdAlgoWinograd;ConvBinWinogradRxSf3x2:9.21299,0,miopenConvolutionFwdAlgoWinograd;GemmFwdRest:14.8044,1207959552,miopenConvolutionFwdAlgoGEMM;ConvDirectNaiveConvFwd:1398.64,0,miopenConvolutionFwdAlgoDirect
512-512-512-3x3-512-512-512-1-1x1-1x1-1x1-0-NCHW-FP32-F=ConvBinWinogradRxSf2x3g1:22.7053,0,miopenConvolutionFwdAlgoWinograd;ConvBinWinogradRxSf3x2:38.6844,0,miopenConvolutionFwdAlgoWinograd;GemmFwdRest:55.6509,4831838208,miopenConvolutionFwdAlgoGEMM;ConvDirectNaiveConvFwd:5682.67,0,miopenConvolutionFwdAlgoDirect
512-512-512-3x3-256-512-512-1-1x1-1x1-1x1-0-NCHW-FP32-F=ConvBinWinogradRxSf2x3g1:10.6288,0,miopenConvolutionFwdAlgoWinograd;ConvBinWinogradRxSf3x2:18.0877,0,miopenConvolutionFwdAlgoWinograd;GemmFwdRest:32.0703,4831838208,miopenConvolutionFwdAlgoGEMM;ConvDirectNaiveConvFwd:3372.99,0,miopenConvolutionFwdAlgoDirect
256-512-512-3x3-256-512-512-1-1x1-1x1-1x1-0-NCHW-FP32-F=ConvBinWinogradRxSf2x3g1:5.42671,0,miopenConvolutionFwdAlgoWinograd;ConvBinWinogradRxSf3x2:9.37417,0,miopenConvolutionFwdAlgoWinograd;GemmFwdRest:15.8629,2415919104,miopenConvolutionFwdAlgoGEMM;ConvDirectNaiveConvFwd:1625.46,0,miopenConvolutionFwdAlgoDirect
512-512-512-1x1-256-512-512-1-0x0-1x1-1x1-0-NCHW-FP32-F=ConvBinWinogradRxSf2x3g1:10.3853,0,miopenConvolutionFwdAlgoWinograd;ConvBinWinogradRxSf3x2:4.77563,0,miopenConvolutionFwdAlgoWinograd;GemmFwd1x1_0_1:2.61227,0,miopenConvolutionFwdAlgoGEMM;ConvDirectNaiveConvFwd:442.277,0,miopenConvolutionFwdAlgoDirect
16-128-32-3x3-512-128-32-1-1x1-1x1-1x1-0-NCHW-FP32-F=ConvBinWinogradRxSf2x3g1:0.02204,0,miopenConvolutionFwdAlgoWinograd;ConvBinWinogradRxSf3x2:0.035784,0,miopenConvolutionFwdAlgoWinograd;GemmFwdRest:0.0431442,2359296,miopenConvolutionFwdAlgoGEMM;ConvDirectNaiveConvFwd:2.82073,0,miopenConvolutionFwdAlgoDirect
512-128-32-3x3-512-128-32-1-1x1-1x1-1x1-0-NCHW-FP32-F=ConvBinWinogradRxSf2x3g1:0.310593,0,miopenConvolutionFwdAlgoWinograd;ConvBinWinogradRxSf3x2:0.607121,0,miopenConvolutionFwdAlgoWinograd;GemmFwdRest:1.09796,75497472,miopenConvolutionFwdAlgoGEMM;ConvDirectNaiveConvFwd:84.3603,0,miopenConvolutionFwdAlgoDirect
512-128-32-1x1-512-128-32-1-0x0-1x1-1x1-0-NCHW-FP32-F=ConvBinWinogradRxSf2x3g1:0.306217,0,miopenConvolutionFwdAlgoWinograd;ConvBinWinogradRxSf3x2:0.162632,0,miopenConvolutionFwdAlgoWinograd;GemmFwd1x1_0_1:0.10832,0,miopenConvolutionFwdAlgoGEMM;ConvDirectNaiveConvFwd:11.1511,0,miopenConvolutionFwdAlgoDirect
512-256-64-3x3-512-256-64-1-1x1-1x1-1x1-0-NCHW-FP32-F=ConvBinWinogradRxSf2x3g1:1.33372,0,miopenConvolutionFwdAlgoWinograd;ConvBinWinogradRxSf3x2:2.33998,0,miopenConvolutionFwdAlgoWinograd;GemmFwdRest:3.38837,301989888,miopenConvolutionFwdAlgoGEMM;ConvDirectNaiveConvFwd:344.243,0,miopenConvolutionFwdAlgoDirect
512-512-128-3x3-512-512-128-1-1x1-1x1-1x1-0-NCHW-FP32-F=ConvBinWinogradRxSf2x3g1:5.19623,0,miopenConvolutionFwdAlgoWinograd;ConvBinWinogradRxSf3x2:9.39021,0,miopenConvolutionFwdAlgoWinograd;GemmFwdRest:14.8225,1207959552,miopenConvolutionFwdAlgoGEMM;ConvDirectNaiveConvFwd:1391.6,0,miopenConvolutionFwdAlgoDirect
512-512-128-3x3-256-512-128-1-1x1-1x1-1x1-0-NCHW-FP32-F=ConvBinWinogradRxSf2x3g1:2.69119,0,miopenConvolutionFwdAlgoWinograd;ConvBinWinogradRxSf3x2:4.74265,0,miopenConvolutionFwdAlgoWinograd;GemmFwdRest:8.32455,1207959552,miopenConvolutionFwdAlgoGEMM;ConvDirectNaiveConvFwd:809.782,0,miopenConvolutionFwdAlgoDirect
256-512-128-3x3-256-512-128-1-1x1-1x1-1x1-0-NCHW-FP32-F=ConvBinWinogradRxSf2x3g1:1.40807,0,miopenConvolutionFwdAlgoWinograd;ConvBinWinogradRxSf3x2:2.3179,0,miopenConvolutionFwdAlgoWinograd;GemmFwdRest:4.33866,603979776,miopenConvolutionFwdAlgoGEMM;ConvDirectNaiveConvFwd:402.214,0,miopenConvolutionFwdAlgoDirect
512-512-128-1x1-256-512-128-1-0x0-1x1-1x1-0-NCHW-FP32-F=ConvBinWinogradRxSf2x3g1:2.45991,0,miopenConvolutionFwdAlgoWinograd;ConvBinWinogradRxSf3x2:1.14699,0,miopenConvolutionFwdAlgoWinograd;GemmFwd1x1_0_1:0.789474,0,miopenConvolutionFwdAlgoGEMM;ConvDirectNaiveConvFwd:109.34,0,miopenConvolutionFwdAlgoDirect
256-1024-256-3x3-256-1024-256-1-1x1-1x1-1x1-0-NCHW-FP32-F=ConvBinWinogradRxSf2x3g1:5.22408,0,miopenConvolutionFwdAlgoWinograd;ConvBinWinogradRxSf3x2:9.28284,0,miopenConvolutionFwdAlgoWinograd;GemmFwdRest:16.3409,2415919104,miopenConvolutionFwdAlgoGEMM;ConvDirectNaiveConvFwd:1652.45,0,miopenConvolutionFwdAlgoDirect
256-1024-256-3x3-128-1024-256-1-1x1-1x1-1x1-0-NCHW-FP32-F=ConvBinWinogradRxSf2x3g1:2.72922,0,miopenConvolutionFwdAlgoWinograd;ConvBinWinogradRxSf3x2:4.74795,0,miopenConvolutionFwdAlgoWinograd;GemmFwdRest:11.0717,2415919104,miopenConvolutionFwdAlgoGEMM;ConvDirectNaiveConvFwd:942.368,0,miopenConvolutionFwdAlgoDirect
128-1024-256-3x3-128-1024-256-1-1x1-1x1-1x1-0-NCHW-FP32-F=ConvBinWinogradRxSf2x3g1:1.44009,0,miopenConvolutionFwdAlgoWinograd;ConvBinWinogradRxSf3x2:2.32983,0,miopenConvolutionFwdAlgoWinograd;GemmFwdRest:5.28801,1207959552,miopenConvolutionFwdAlgoGEMM;ConvDirectNaiveConvFwd:466.115,0,miopenConvolutionFwdAlgoDirect
256-1024-256-1x1-128-1024-256-1-0x0-1x1-1x1-0-NCHW-FP32-F=ConvBinWinogradRxSf2x3g1:2.46512,0,miopenConvolutionFwdAlgoWinograd;ConvBinWinogradRxSf3x2:1.28928,0,miopenConvolutionFwdAlgoWinograd;GemmFwd1x1_0_1:0.639481,0,miopenConvolutionFwdAlgoGEMM;ConvDirectNaiveConvFwd:113.493,0,miopenConvolutionFwdAlgoDirect
128-1024-256-3x3-3-1024-256-1-1x1-1x1-1x1-0-NCHW-FP32-F=ConvBinWinogradRxSf2x3g1:0.300113,0,miopenConvolutionFwdAlgoWinograd;ConvBinWinogradRxSf3x2:0.515561,0,miopenConvolutionFwdAlgoWinograd;GemmFwdRest:5.07919,1207959552,miopenConvolutionFwdAlgoGEMM;ConvDirectNaiveConvFwd:266.21,0,miopenConvolutionFwdAlgoDirect
16-128-17-3x3-512-128-17-1-1x1-1x1-1x1-0-NCHW-FP32-F=ConvBinWinogradRxSf2x3g1:0.01444,0,miopenConvolutionFwdAlgoWinograd;ConvBinWinogradRxSf3x2:0.0269522,0,miopenConvolutionFwdAlgoWinograd;GemmFwdRest:0.041552,1253376,miopenConvolutionFwdAlgoGEMM;ConvDirectNaiveConvFwd:1.37773,0,miopenConvolutionFwdAlgoDirect
512-128-17-3x3-512-128-17-1-1x1-1x1-1x1-0-NCHW-FP32-F=ConvBinWinogradRxSf2x3g1:0.159568,0,miopenConvolutionFwdAlgoWinograd;ConvBinWinogradRxSf3x2:0.406329,0,miopenConvolutionFwdAlgoWinograd;GemmFwdRest:0.607065,40108032,miopenConvolutionFwdAlgoGEMM;ConvDirectNaiveConvFwd:44.5388,0,miopenConvolutionFwdAlgoDirect
512-128-17-1x1-512-128-17-1-0x0-1x1-1x1-0-NCHW-FP32-F=ConvBinWinogradRxSf2x3g1:0.157064,0,miopenConvolutionFwdAlgoWinograd;ConvBinWinogradRxSf3x2:0.111472,0,miopenConvolutionFwdAlgoWinograd;GemmFwd1x1_0_1:0.0786162,0,miopenConvolutionFwdAlgoGEMM;ConvDirectNaiveConvFwd:5.7832,0,miopenConvolutionFwdAlgoDirect
512-256-34-3x3-512-256-34-1-1x1-1x1-1x1-0-NCHW-FP32-F=ConvBinWinogradRxSf2x3g1:0.753265,0,miopenConvolutionFwdAlgoWinograd;ConvBinWinogradRxSf3x2:1.27485,0,miopenConvolutionFwdAlgoWinograd;GemmFwdRest:3.51566,160432128,miopenConvolutionFwdAlgoGEMM;ConvDirectNaiveConvFwd:192.513,0,miopenConvolutionFwdAlgoDirect
512-512-68-3x3-512-512-68-1-1x1-1x1-1x1-0-NCHW-FP32-F=ConvBinWinogradRxSf2x3g1:2.82489,0,miopenConvolutionFwdAlgoWinograd;ConvBinWinogradRxSf3x2:5.14025,0,miopenConvolutionFwdAlgoWinograd;GemmFwdRest:7.60187,641728512,miopenConvolutionFwdAlgoGEMM;ConvDirectNaiveConvFwd:788.619,0,miopenConvolutionFwdAlgoDirect
512-512-68-3x3-256-512-68-1-1x1-1x1-1x1-0-NCHW-FP32-F=ConvBinWinogradRxSf2x3g1:1.42311,0,miopenConvolutionFwdAlgoWinograd;ConvBinWinogradRxSf3x2:2.60363,0,miopenConvolutionFwdAlgoWinograd;GemmFwdRest:4.09422,641728512,miopenConvolutionFwdAlgoGEMM;ConvDirectNaiveConvFwd:422.964,0,miopenConvolutionFwdAlgoDirect
256-512-68-3x3-256-512-68-1-1x1-1x1-1x1-0-NCHW-FP32-F=ConvBinWinogradRxSf2x3g1:0.688361,0,miopenConvolutionFwdAlgoWinograd;ConvBinWinogradRxSf3x2:1.22896,0,miopenConvolutionFwdAlgoWinograd;GemmFwdRest:2.00619,320864256,miopenConvolutionFwdAlgoGEMM;ConvDirectNaiveConvFwd:207.948,0,miopenConvolutionFwdAlgoDirect
512-512-68-1x1-256-512-68-1-0x0-1x1-1x1-0-NCHW-FP32-F=ConvBinWinogradRxSf2x3g1:1.25891,0,miopenConvolutionFwdAlgoWinograd;ConvBinWinogradRxSf3x2:0.579065,0,miopenConvolutionFwdAlgoWinograd;GemmFwd1x1_0_1:0.366457,0,miopenConvolutionFwdAlgoGEMM;ConvDirectNaiveConvFwd:55.7522,0,miopenConvolutionFwdAlgoDirect
256-1024-136-3x3-256-1024-136-1-1x1-1x1-1x1-0-NCHW-FP32-F=ConvBinWinogradRxSf2x3g1:2.83374,0,miopenConvolutionFwdAlgoWinograd;ConvBinWinogradRxSf3x2:5.03008,0,miopenConvolutionFwdAlgoWinograd;GemmFwdRest:8.57449,1283457024,miopenConvolutionFwdAlgoGEMM;ConvDirectNaiveConvFwd:855.854,0,miopenConvolutionFwdAlgoDirect
256-1024-136-3x3-128-1024-136-1-1x1-1x1-1x1-0-NCHW-FP32-F=ConvBinWinogradRxSf2x3g1:1.45782,0,miopenConvolutionFwdAlgoWinograd;ConvBinWinogradRxSf3x2:2.51732,0,miopenConvolutionFwdAlgoWinograd;GemmFwdRest:5.2344,1283457024,miopenConvolutionFwdAlgoGEMM;ConvDirectNaiveConvFwd:482.02,0,miopenConvolutionFwdAlgoDirect
128-1024-136-3x3-128-1024-136-1-1x1-1x1-1x1-0-NCHW-FP32-F=ConvBinWinogradRxSf2x3g1:0.703417,0,miopenConvolutionFwdAlgoWinograd;ConvBinWinogradRxSf3x2:1.27875,0,miopenConvolutionFwdAlgoWinograd;GemmFwdRest:2.64796,641728512,miopenConvolutionFwdAlgoGEMM;ConvDirectNaiveConvFwd:237.903,0,miopenConvolutionFwdAlgoDirect
256-1024-136-1x1-128-1024-136-1-0x0-1x1-1x1-0-NCHW-FP32-F=ConvBinWinogradRxSf2x3g1:1.33723,0,miopenConvolutionFwdAlgoWinograd;ConvBinWinogradRxSf3x2:0.658721,0,miopenConvolutionFwdAlgoWinograd;GemmFwd1x1_0_1:0.360617,0,miopenConvolutionFwdAlgoGEMM;ConvDirectNaiveConvFwd:60.2033,0,miopenConvolutionFwdAlgoDirect
128-1024-136-3x3-3-1024-136-1-1x1-1x1-1x1-0-NCHW-FP32-F=ConvBinWinogradRxSf2x3g1:0.167096,0,miopenConvolutionFwdAlgoWinograd;ConvBinWinogradRxSf3x2:0.312529,0,miopenConvolutionFwdAlgoWinograd;GemmFwdRest:1.95024,641728512,miopenConvolutionFwdAlgoGEMM;ConvDirectNaiveConvFwd:130.575,0,miopenConvolutionFwdAlgoDirect
16-32-128-3x3-512-32-128-1-1x1-1x1-1x1-0-NCHW-FP32-F=ConvBinWinogradRxSf2x3g1:0.0218642,0,miopenConvolutionFwdAlgoWinograd;ConvBinWinogradRxSf3x2:0.03576,0,miopenConvolutionFwdAlgoWinograd;GemmFwdRest:0.0428642,2359296,miopenConvolutionFwdAlgoGEMM;ConvDirectNaiveConvFwd:2.56459,0,miopenConvolutionFwdAlgoDirect
512-32-128-3x3-512-32-128-1-1x1-1x1-1x1-0-NCHW-FP32-F=ConvBinWinogradRxSf2x3g1:0.311161,0,miopenConvolutionFwdAlgoWinograd;ConvBinWinogradRxSf3x2:0.607233,0,miopenConvolutionFwdAlgoWinograd;GemmFwdRest:1.09877,75497472,miopenConvolutionFwdAlgoGEMM;ConvDirectNaiveConvFwd:83.6881,0,miopenConvolutionFwdAlgoDirect
512-32-128-1x1-512-32-128-1-0x0-1x1-1x1-0-NCHW-FP32-F=ConvBinWinogradRxSf2x3g1:0.306712,0,miopenConvolutionFwdAlgoWinograd;ConvBinWinogradRxSf3x2:0.16268,0,miopenConvolutionFwdAlgoWinograd;GemmFwd1x1_0_1:0.108232,0,miopenConvolutionFwdAlgoGEMM;ConvDirectNaiveConvFwd:11.1765,0,miopenConvolutionFwdAlgoDirect
512-64-256-3x3-512-64-256-1-1x1-1x1-1x1-0-NCHW-FP32-F=ConvBinWinogradRxSf2x3g1:1.32729,0,miopenConvolutionFwdAlgoWinograd;ConvBinWinogradRxSf3x2:2.36601,0,miopenConvolutionFwdAlgoWinograd;GemmFwdRest:3.30007,301989888,miopenConvolutionFwdAlgoGEMM;ConvDirectNaiveConvFwd:346.48,0,miopenConvolutionFwdAlgoDirect
512-128-512-3x3-512-128-512-1-1x1-1x1-1x1-0-NCHW-FP32-F=ConvBinWinogradRxSf2x3g1:5.19825,0,miopenConvolutionFwdAlgoWinograd;ConvBinWinogradRxSf3x2:9.44717,0,miopenConvolutionFwdAlgoWinograd;GemmFwdRest:14.8951,1207959552,miopenConvolutionFwdAlgoGEMM;ConvDirectNaiveConvFwd:1384.18,0,miopenConvolutionFwdAlgoDirect
512-128-512-3x3-256-128-512-1-1x1-1x1-1x1-0-NCHW-FP32-F=ConvBinWinogradRxSf2x3g1:2.69983,0,miopenConvolutionFwdAlgoWinograd;ConvBinWinogradRxSf3x2:4.81066,0,miopenConvolutionFwdAlgoWinograd;GemmFwdRest:8.36928,1207959552,miopenConvolutionFwdAlgoGEMM;ConvDirectNaiveConvFwd:807.677,0,miopenConvolutionFwdAlgoDirect
256-128-512-3x3-256-128-512-1-1x1-1x1-1x1-0-NCHW-FP32-F=ConvBinWinogradRxSf2x3g1:1.37806,0,miopenConvolutionFwdAlgoWinograd;ConvBinWinogradRxSf3x2:2.31219,0,miopenConvolutionFwdAlgoWinograd;GemmFwdRest:4.25854,603979776,miopenConvolutionFwdAlgoGEMM;ConvDirectNaiveConvFwd:398.869,0,miopenConvolutionFwdAlgoDirect
512-128-512-1x1-256-128-512-1-0x0-1x1-1x1-0-NCHW-FP32-F=ConvBinWinogradRxSf2x3g1:2.48361,0,miopenConvolutionFwdAlgoWinograd;ConvBinWinogradRxSf3x2:1.18991,0,miopenConvolutionFwdAlgoWinograd;GemmFwd1x1_0_1:0.783938,0,miopenConvolutionFwdAlgoGEMM;ConvDirectNaiveConvFwd:107.809,0,miopenConvolutionFwdAlgoDirect
256-256-1024-3x3-256-256-1024-1-1x1-1x1-1x1-0-NCHW-FP32-F=ConvBinWinogradRxSf2x3g1:5.26614,0,miopenConvolutionFwdAlgoWinograd;ConvBinWinogradRxSf3x2:9.33494,0,miopenConvolutionFwdAlgoWinograd;GemmFwdRest:15.3317,2415919104,miopenConvolutionFwdAlgoGEMM;ConvDirectNaiveConvFwd:1628.9,0,miopenConvolutionFwdAlgoDirect
256-256-1024-3x3-128-256-1024-1-1x1-1x1-1x1-0-NCHW-FP32-F=ConvBinWinogradRxSf2x3g1:2.77495,0,miopenConvolutionFwdAlgoWinograd;ConvBinWinogradRxSf3x2:4.77186,0,miopenConvolutionFwdAlgoWinograd;GemmFwdRest:9.66647,2415919104,miopenConvolutionFwdAlgoGEMM;ConvDirectNaiveConvFwd:926.517,0,miopenConvolutionFwdAlgoDirect
128-256-1024-3x3-128-256-1024-1-1x1-1x1-1x1-0-NCHW-FP32-F=ConvBinWinogradRxSf2x3g1:1.40635,0,miopenConvolutionFwdAlgoWinograd;ConvBinWinogradRxSf3x2:2.32784,0,miopenConvolutionFwdAlgoWinograd;GemmFwdRest:4.76864,1207959552,miopenConvolutionFwdAlgoGEMM;ConvDirectNaiveConvFwd:456.268,0,miopenConvolutionFwdAlgoDirect
256-256-1024-1x1-128-256-1024-1-0x0-1x1-1x1-0-NCHW-FP32-F=ConvBinWinogradRxSf2x3g1:2.50086,0,miopenConvolutionFwdAlgoWinograd;ConvBinWinogradRxSf3x2:1.22278,0,miopenConvolutionFwdAlgoWinograd;GemmFwd1x1_0_1:0.633169,0,miopenConvolutionFwdAlgoGEMM;ConvDirectNaiveConvFwd:112.813,0,miopenConvolutionFwdAlgoDirect
128-256-1024-3x3-3-256-1024-1-1x1-1x1-1x1-0-NCHW-FP32-F=ConvBinWinogradRxSf2x3g1:0.300785,0,miopenConvolutionFwdAlgoWinograd;ConvBinWinogradRxSf3x2:0.515321,0,miopenConvolutionFwdAlgoWinograd;GemmFwdRest:4.70465,1207959552,miopenConvolutionFwdAlgoGEMM;ConvDirectNaiveConvFwd:267.924,0,miopenConvolutionFwdAlgoDirect
16-17-128-3x3-512-17-128-1-1x1-1x1-1x1-0-NCHW-FP32-F=ConvBinWinogradRxSf2x3g1:0.014352,0,miopenConvolutionFwdAlgoWinograd;ConvBinWinogradRxSf3x2:0.0257122,0,miopenConvolutionFwdAlgoWinograd;GemmFwdRest:0.041136,1253376,miopenConvolutionFwdAlgoGEMM;ConvDirectNaiveConvFwd:1.36821,0,miopenConvolutionFwdAlgoDirect
512-17-128-3x3-512-17-128-1-1x1-1x1-1x1-0-NCHW-FP32-F=ConvBinWinogradRxSf2x3g1:0.15956,0,miopenConvolutionFwdAlgoWinograd;ConvBinWinogradRxSf3x2:0.404353,0,miopenConvolutionFwdAlgoWinograd;GemmFwdRest:0.583905,40108032,miopenConvolutionFwdAlgoGEMM;ConvDirectNaiveConvFwd:44.223,0,miopenConvolutionFwdAlgoDirect
512-17-128-1x1-512-17-128-1-0x0-1x1-1x1-0-NCHW-FP32-F=ConvBinWinogradRxSf2x3g1:0.1568,0,miopenConvolutionFwdAlgoWinograd;ConvBinWinogradRxSf3x2:0.1104,0,miopenConvolutionFwdAlgoWinograd;GemmFwd1x1_0_1:0.0804082,0,miopenConvolutionFwdAlgoGEMM;ConvDirectNaiveConvFwd:5.85144,0,miopenConvolutionFwdAlgoDirect
512-34-256-3x3-512-34-256-1-1x1-1x1-1x1-0-NCHW-FP32-F=ConvBinWinogradRxSf2x3g1:0.744737,0,miopenConvolutionFwdAlgoWinograd;ConvBinWinogradRxSf3x2:1.25986,0,miopenConvolutionFwdAlgoWinograd;GemmFwdRest:3.45201,160432128,miopenConvolutionFwdAlgoGEMM;ConvDirectNaiveConvFwd:187.61,0,miopenConvolutionFwdAlgoDirect
512-68-512-3x3-512-68-512-1-1x1-1x1-1x1-0-NCHW-FP32-F=ConvBinWinogradRxSf2x3g1:2.85771,0,miopenConvolutionFwdAlgoWinograd;ConvBinWinogradRxSf3x2:5.08497,0,miopenConvolutionFwdAlgoWinograd;GemmFwdRest:7.65936,641728512,miopenConvolutionFwdAlgoGEMM;ConvDirectNaiveConvFwd:728.755,0,miopenConvolutionFwdAlgoDirect
512-68-512-3x3-256-68-512-1-1x1-1x1-1x1-0-NCHW-FP32-F=ConvBinWinogradRxSf2x3g1:1.43023,0,miopenConvolutionFwdAlgoWinograd;ConvBinWinogradRxSf3x2:2.58787,0,miopenConvolutionFwdAlgoWinograd;GemmFwdRest:4.19275,641728512,miopenConvolutionFwdAlgoGEMM;ConvDirectNaiveConvFwd:423.239,0,miopenConvolutionFwdAlgoDirect
256-68-512-3x3-256-68-512-1-1x1-1x1-1x1-0-NCHW-FP32-F=ConvBinWinogradRxSf2x3g1:0.723489,0,miopenConvolutionFwdAlgoWinograd;ConvBinWinogradRxSf3x2:1.16367,0,miopenConvolutionFwdAlgoWinograd;GemmFwdRest:2.03311,320864256,miopenConvolutionFwdAlgoGEMM;ConvDirectNaiveConvFwd:208.544,0,miopenConvolutionFwdAlgoDirect
512-68-512-1x1-256-68-512-1-0x0-1x1-1x1-0-NCHW-FP32-F=ConvBinWinogradRxSf2x3g1:1.2661,0,miopenConvolutionFwdAlgoWinograd;ConvBinWinogradRxSf3x2:0.577593,0,miopenConvolutionFwdAlgoWinograd;GemmFwd1x1_0_1:0.367017,0,miopenConvolutionFwdAlgoGEMM;ConvDirectNaiveConvFwd:55.8114,0,miopenConvolutionFwdAlgoDirect
256-136-1024-3x3-256-136-1024-1-1x1-1x1-1x1-0-NCHW-FP32-F=ConvBinWinogradRxSf2x3g1:2.84261,0,miopenConvolutionFwdAlgoWinograd;ConvBinWinogradRxSf3x2:5.04103,0,miopenConvolutionFwdAlgoWinograd;GemmFwdRest:8.42188,1283457024,miopenConvolutionFwdAlgoGEMM;ConvDirectNaiveConvFwd:857.421,0,miopenConvolutionFwdAlgoDirect
256-136-1024-3x3-128-136-1024-1-1x1-1x1-1x1-0-NCHW-FP32-F=ConvBinWinogradRxSf2x3g1:1.45711,0,miopenConvolutionFwdAlgoWinograd;ConvBinWinogradRxSf3x2:2.46679,0,miopenConvolutionFwdAlgoWinograd;GemmFwdRest:5.33331,1283457024,miopenConvolutionFwdAlgoGEMM;ConvDirectNaiveConvFwd:479.673,0,miopenConvolutionFwdAlgoDirect
128-136-1024-3x3-128-136-1024-1-1x1-1x1-1x1-0-NCHW-FP32-F=ConvBinWinogradRxSf2x3g1:0.686201,0,miopenConvolutionFwdAlgoWinograd;ConvBinWinogradRxSf3x2:1.23566,0,miopenConvolutionFwdAlgoWinograd;GemmFwdRest:2.5446,641728512,miopenConvolutionFwdAlgoGEMM;ConvDirectNaiveConvFwd:238.714,0,miopenConvolutionFwdAlgoDirect
256-136-1024-1x1-128-136-1024-1-0x0-1x1-1x1-0-NCHW-FP32-F=ConvBinWinogradRxSf2x3g1:1.41681,0,miopenConvolutionFwdAlgoWinograd;ConvBinWinogradRxSf3x2:0.652841,0,miopenConvolutionFwdAlgoWinograd;GemmFwd1x1_0_1:0.361433,0,miopenConvolutionFwdAlgoGEMM;ConvDirectNaiveConvFwd:60.0211,0,miopenConvolutionFwdAlgoDirect
128-136-1024-3x3-3-136-1024-1-1x1-1x1-1x1-0-NCHW-FP32-F=ConvBinWinogradRxSf2x3g1:0.16716,0,miopenConvolutionFwdAlgoWinograd;ConvBinWinogradRxSf3x2:0.31192,0,miopenConvolutionFwdAlgoWinograd;GemmFwdRest:1.88564,641728512,miopenConvolutionFwdAlgoGEMM;ConvDirectNaiveConvFwd:141.276,0,miopenConvolutionFwdAlgoDirect
16-64-64-3x3-512-64-64-1-1x1-1x1-1x1-0-NCHW-FP32-F=ConvBinWinogradRxSf2x3g1:0.022176,0,miopenConvolutionFwdAlgoWinograd;ConvBinWinogradRxSf3x2:0.03548,0,miopenConvolutionFwdAlgoWinograd;GemmFwdRest:0.048464,2359296,miopenConvolutionFwdAlgoGEMM;ConvDirectNaiveConvFwd:2.65548,0,miopenConvolutionFwdAlgoDirect
512-64-64-3x3-512-64-64-1-1x1-1x1-1x1-0-NCHW-FP32-F=ConvBinWinogradRxSf2x3g1:0.311185,0,miopenConvolutionFwdAlgoWinograd;ConvBinWinogradRxSf3x2:0.607017,0,miopenConvolutionFwdAlgoWinograd;GemmFwdRest:1.09984,75497472,miopenConvolutionFwdAlgoGEMM;ConvDirectNaiveConvFwd:84.6888,0,miopenConvolutionFwdAlgoDirect
512-64-64-1x1-512-64-64-1-0x0-1x1-1x1-0-NCHW-FP32-F=ConvBinWinogradRxSf2x3g1:0.306521,0,miopenConvolutionFwdAlgoWinograd;ConvBinWinogradRxSf3x2:0.162856,0,miopenConvolutionFwdAlgoWinograd;GemmFwd1x1_0_1:0.107288,0,miopenConvolutionFwdAlgoGEMM;ConvDirectNaiveConvFwd:10.9623,0,miopenConvolutionFwdAlgoDirect
512-256-256-3x3-256-256-256-1-1x1-1x1-1x1-0-NCHW-FP32-F=ConvBinWinogradRxSf2x3g1:2.68717,0,miopenConvolutionFwdAlgoWinograd;ConvBinWinogradRxSf3x2:4.73728,0,miopenConvolutionFwdAlgoWinograd;GemmFwdRest:8.49266,1207959552,miopenConvolutionFwdAlgoGEMM;ConvDirectNaiveConvFwd:806.697,0,miopenConvolutionFwdAlgoDirect
256-256-256-3x3-256-256-256-1-1x1-1x1-1x1-0-NCHW-FP32-F=ConvBinWinogradRxSf2x3g1:1.37905,0,miopenConvolutionFwdAlgoWinograd;ConvBinWinogradRxSf3x2:2.31241,0,miopenConvolutionFwdAlgoWinograd;GemmFwdRest:4.2886,603979776,miopenConvolutionFwdAlgoGEMM;ConvDirectNaiveConvFwd:400.446,0,miopenConvolutionFwdAlgoDirect
512-256-256-1x1-256-256-256-1-0x0-1x1-1x1-0-NCHW-FP32-F=ConvBinWinogradRxSf2x3g1:2.4838,0,miopenConvolutionFwdAlgoWinograd;ConvBinWinogradRxSf3x2:1.12775,0,miopenConvolutionFwdAlgoWinograd;GemmFwd1x1_0_1:0.790354,0,miopenConvolutionFwdAlgoGEMM;ConvDirectNaiveConvFwd:107.681,0,miopenConvolutionFwdAlgoDirect
256-512-512-3x3-128-512-512-1-1x1-1x1-1x1-0-NCHW-FP32-F=ConvBinWinogradRxSf2x3g1:2.74156,0,miopenConvolutionFwdAlgoWinograd;ConvBinWinogradRxSf3x2:4.75677,0,miopenConvolutionFwdAlgoWinograd;GemmFwdRest:10.2822,2415919104,miopenConvolutionFwdAlgoGEMM;ConvDirectNaiveConvFwd:925.93,0,miopenConvolutionFwdAlgoDirect
128-512-512-3x3-128-512-512-1-1x1-1x1-1x1-0-NCHW-FP32-F=ConvBinWinogradRxSf2x3g1:1.43767,0,miopenConvolutionFwdAlgoWinograd;ConvBinWinogradRxSf3x2:2.33567,0,miopenConvolutionFwdAlgoWinograd;GemmFwdRest:5.07165,1207959552,miopenConvolutionFwdAlgoGEMM;ConvDirectNaiveConvFwd:458.56,0,miopenConvolutionFwdAlgoDirect
256-512-512-1x1-128-512-512-1-0x0-1x1-1x1-0-NCHW-FP32-F=ConvBinWinogradRxSf2x3g1:2.47568,0,miopenConvolutionFwdAlgoWinograd;ConvBinWinogradRxSf3x2:1.2959,0,miopenConvolutionFwdAlgoWinograd;GemmFwd1x1_0_1:0.624745,0,miopenConvolutionFwdAlgoGEMM;ConvDirectNaiveConvFwd:113.359,0,miopenConvolutionFwdAlgoDirect
128-512-512-3x3-3-512-512-1-1x1-1x1-1x1-0-NCHW-FP32-F=ConvBinWinogradRxSf2x3g1:0.310097,0,miopenConvolutionFwdAlgoWinograd;ConvBinWinogradRxSf3x2:0.518081,0,miopenConvolutionFwdAlgoWinograd;GemmFwdRest:5.0407,1207959552,miopenConvolutionFwdAlgoGEMM;ConvDirectNaiveConvFwd:269.192,0,miopenConvolutionFwdAlgoDirect
16-64-32-3x3-512-64-32-1-1x1-1x1-1x1-0-NCHW-FP32-F=ConvBinWinogradRxSf2x3g1:0.014448,0,miopenConvolutionFwdAlgoWinograd;ConvBinWinogradRxSf3x2:0.0256002,0,miopenConvolutionFwdAlgoWinograd;GemmFwdRest:0.0431602,1179648,miopenConvolutionFwdAlgoGEMM;ConvDirectNaiveConvFwd:1.32403,0,miopenConvolutionFwdAlgoDirect
512-64-32-3x3-512-64-32-1-1x1-1x1-1x1-0-NCHW-FP32-F=ConvBinWinogradRxSf2x3g1:0.159808,0,miopenConvolutionFwdAlgoWinograd;ConvBinWinogradRxSf3x2:0.403993,0,miopenConvolutionFwdAlgoWinograd;GemmFwdRest:0.644497,37748736,miopenConvolutionFwdAlgoGEMM;ConvDirectNaiveConvFwd:44.4243,0,miopenConvolutionFwdAlgoDirect
512-64-32-1x1-512-64-32-1-0x0-1x1-1x1-0-NCHW-FP32-F=ConvBinWinogradRxSf2x3g1:0.156512,0,miopenConvolutionFwdAlgoWinograd;ConvBinWinogradRxSf3x2:0.109752,0,miopenConvolutionFwdAlgoWinograd;GemmFwd1x1_0_1:0.08108,0,miopenConvolutionFwdAlgoGEMM;ConvDirectNaiveConvFwd:5.80038,0,miopenConvolutionFwdAlgoDirect
512-128-64-3x3-512-128-64-1-1x1-1x1-1x1-0-NCHW-FP32-F=ConvBinWinogradRxSf2x3g1:0.677369,0,miopenConvolutionFwdAlgoWinograd;ConvBinWinogradRxSf3x2:1.04678,0,miopenConvolutionFwdAlgoWinograd;GemmFwdRest:3.22693,150994944,miopenConvolutionFwdAlgoGEMM;ConvDirectNaiveConvFwd:174.788,0,miopenConvolutionFwdAlgoDirect
512-256-128-3x3-512-256-128-1-1x1-1x1-1x1-0-NCHW-FP32-F=ConvBinWinogradRxSf2x3g1:2.64609,0,miopenConvolutionFwdAlgoWinograd;ConvBinWinogradRxSf3x2:4.8683,0,miopenConvolutionFwdAlgoWinograd;GemmFwdRest:6.76603,603979776,miopenConvolutionFwdAlgoGEMM;ConvDirectNaiveConvFwd:692.297,0,miopenConvolutionFwdAlgoDirect
512-256-128-3x3-256-256-128-1-1x1-1x1-1x1-0-NCHW-FP32-F=ConvBinWinogradRxSf2x3g1:1.37978,0,miopenConvolutionFwdAlgoWinograd;ConvBinWinogradRxSf3x2:2.37903,0,miopenConvolutionFwdAlgoWinograd;GemmFwdRest:3.70154,603979776,miopenConvolutionFwdAlgoGEMM;ConvDirectNaiveConvFwd:402.059,0,miopenConvolutionFwdAlgoDirect
256-256-128-3x3-256-256-128-1-1x1-1x1-1x1-0-NCHW-FP32-F=ConvBinWinogradRxSf2x3g1:0.628345,0,miopenConvolutionFwdAlgoWinograd;ConvBinWinogradRxSf3x2:1.19834,0,miopenConvolutionFwdAlgoWinograd;GemmFwdRest:1.89528,301989888,miopenConvolutionFwdAlgoGEMM;ConvDirectNaiveConvFwd:198.293,0,miopenConvolutionFwdAlgoDirect
512-256-128-1x1-256-256-128-1-0x0-1x1-1x1-0-NCHW-FP32-F=ConvBinWinogradRxSf2x3g1:1.18121,0,miopenConvolutionFwdAlgoWinograd;ConvBinWinogradRxSf3x2:0.528273,0,miopenConvolutionFwdAlgoWinograd;GemmFwd1x1_0_1:0.343473,0,miopenConvolutionFwdAlgoGEMM;ConvDirectNaiveConvFwd:53.5963,0,miopenConvolutionFwdAlgoDirect
256-512-256-3x3-256-512-256-1-1x1-1x1-1x1-0-NCHW-FP32-F=ConvBinWinogradRxSf2x3g1:2.68418,0,miopenConvolutionFwdAlgoWinograd;ConvBinWinogradRxSf3x2:4.75163,0,miopenConvolutionFwdAlgoWinograd;GemmFwdRest:7.8787,1207959552,miopenConvolutionFwdAlgoGEMM;ConvDirectNaiveConvFwd:809.315,0,miopenConvolutionFwdAlgoDirect
256-512-256-3x3-128-512-256-1-1x1-1x1-1x1-0-NCHW-FP32-F=ConvBinWinogradRxSf2x3g1:1.36439,0,miopenConvolutionFwdAlgoWinograd;ConvBinWinogradRxSf3x2:2.27825,0,miopenConvolutionFwdAlgoWinograd;GemmFwdRest:5.07843,1207959552,miopenConvolutionFwdAlgoGEMM;ConvDirectNaiveConvFwd:481.667,0,miopenConvolutionFwdAlgoDirect
128-512-256-3x3-128-512-256-1-1x1-1x1-1x1-0-NCHW-FP32-F=ConvBinWinogradRxSf2x3g1:0.741722,0,miopenConvolutionFwdAlgoWinograd;ConvBinWinogradRxSf3x2:1.15287,0,miopenConvolutionFwdAlgoWinograd;GemmFwdRest:2.51239,603979776,miopenConvolutionFwdAlgoGEMM;ConvDirectNaiveConvFwd:226.785,0,miopenConvolutionFwdAlgoDirect
256-512-256-1x1-128-512-256-1-0x0-1x1-1x1-0-NCHW-FP32-F=ConvBinWinogradRxSf2x3g1:1.27076,0,miopenConvolutionFwdAlgoWinograd;ConvBinWinogradRxSf3x2:0.624217,0,miopenConvolutionFwdAlgoWinograd;GemmFwd1x1_0_1:0.344261,0,miopenConvolutionFwdAlgoGEMM;ConvDirectNaiveConvFwd:56.9497,0,miopenConvolutionFwdAlgoDirect
128-512-256-3x3-3-512-256-1-1x1-1x1-1x1-0-NCHW-FP32-F=ConvBinWinogradRxSf2x3g1:0.153408,0,miopenConvolutionFwdAlgoWinograd;ConvBinWinogradRxSf3x2:0.26156,0,miopenConvolutionFwdAlgoWinograd;GemmFwdRest:2.42768,603979776,miopenConvolutionFwdAlgoGEMM;ConvDirectNaiveConvFwd:132.48,0,miopenConvolutionFwdAlgoDirect
16-32-64-3x3-512-32-64-1-1x1-1x1-1x1-0-NCHW-FP32-F=ConvBinWinogradRxSf2x3g1:0.01428,0,miopenConvolutionFwdAlgoWinograd;ConvBinWinogradRxSf3x2:0.0255282,0,miopenConvolutionFwdAlgoWinograd;GemmFwdRest:0.04136,1179648,miopenConvolutionFwdAlgoGEMM;ConvDirectNaiveConvFwd:1.28111,0,miopenConvolutionFwdAlgoDirect
512-32-64-3x3-512-32-64-1-1x1-1x1-1x1-0-NCHW-FP32-F=ConvBinWinogradRxSf2x3g1:0.163288,0,miopenConvolutionFwdAlgoWinograd;ConvBinWinogradRxSf3x2:0.405393,0,miopenConvolutionFwdAlgoWinograd;GemmFwdRest:0.593429,37748736,miopenConvolutionFwdAlgoGEMM;ConvDirectNaiveConvFwd:44.8677,0,miopenConvolutionFwdAlgoDirect
512-32-64-1x1-512-32-64-1-0x0-1x1-1x1-0-NCHW-FP32-F=ConvBinWinogradRxSf2x3g1:0.157456,0,miopenConvolutionFwdAlgoWinograd;ConvBinWinogradRxSf3x2:0.11216,0,miopenConvolutionFwdAlgoWinograd;GemmFwd1x1_0_1:0.0828562,0,miopenConvolutionFwdAlgoGEMM;ConvDirectNaiveConvFwd:5.7306,0,miopenConvolutionFwdAlgoDirect
512-64-128-3x3-512-64-128-1-1x1-1x1-1x1-0-NCHW-FP32-F=ConvBinWinogradRxSf2x3g1:0.653393,0,miopenConvolutionFwdAlgoWinograd;ConvBinWinogradRxSf3x2:1.05163,0,miopenConvolutionFwdAlgoWinograd;GemmFwdRest:3.24771,150994944,miopenConvolutionFwdAlgoGEMM;ConvDirectNaiveConvFwd:178.799,0,miopenConvolutionFwdAlgoDirect
512-128-256-3x3-512-128-256-1-1x1-1x1-1x1-0-NCHW-FP32-F=ConvBinWinogradRxSf2x3g1:2.64889,0,miopenConvolutionFwdAlgoWinograd;ConvBinWinogradRxSf3x2:4.89958,0,miopenConvolutionFwdAlgoWinograd;GemmFwdRest:6.82321,603979776,miopenConvolutionFwdAlgoGEMM;ConvDirectNaiveConvFwd:691.494,0,miopenConvolutionFwdAlgoDirect
512-128-256-3x3-256-128-256-1-1x1-1x1-1x1-0-NCHW-FP32-F=ConvBinWinogradRxSf2x3g1:1.3609,0,miopenConvolutionFwdAlgoWinograd;ConvBinWinogradRxSf3x2:2.33802,0,miopenConvolutionFwdAlgoWinograd;GemmFwdRest:3.73946,603979776,miopenConvolutionFwdAlgoGEMM;ConvDirectNaiveConvFwd:402.232,0,miopenConvolutionFwdAlgoDirect
256-128-256-3x3-256-128-256-1-1x1-1x1-1x1-0-NCHW-FP32-F=ConvBinWinogradRxSf2x3g1:0.624121,0,miopenConvolutionFwdAlgoWinograd;ConvBinWinogradRxSf3x2:1.17525,0,miopenConvolutionFwdAlgoWinograd;GemmFwdRest:1.87372,301989888,miopenConvolutionFwdAlgoGEMM;ConvDirectNaiveConvFwd:198.379,0,miopenConvolutionFwdAlgoDirect
512-128-256-1x1-256-128-256-1-0x0-1x1-1x1-0-NCHW-FP32-F=ConvBinWinogradRxSf2x3g1:1.15721,0,miopenConvolutionFwdAlgoWinograd;ConvBinWinogradRxSf3x2:0.528769,0,miopenConvolutionFwdAlgoWinograd;GemmFwd1x1_0_1:0.343249,0,miopenConvolutionFwdAlgoGEMM;ConvDirectNaiveConvFwd:53.076,0,miopenConvolutionFwdAlgoDirect
256-256-512-3x3-256-256-512-1-1x1-1x1-1x1-0-NCHW-FP32-F=ConvBinWinogradRxSf2x3g1:2.70159,0,miopenConvolutionFwdAlgoWinograd;ConvBinWinogradRxSf3x2:4.78314,0,miopenConvolutionFwdAlgoWinograd;GemmFwdRest:7.75898,1207959552,miopenConvolutionFwdAlgoGEMM;ConvDirectNaiveConvFwd:809.642,0,miopenConvolutionFwdAlgoDirect
256-256-512-3x3-128-256-512-1-1x1-1x1-1x1-0-NCHW-FP32-F=ConvBinWinogradRxSf2x3g1:1.37211,0,miopenConvolutionFwdAlgoWinograd;ConvBinWinogradRxSf3x2:2.36303,0,miopenConvolutionFwdAlgoWinograd;GemmFwdRest:4.89227,1207959552,miopenConvolutionFwdAlgoGEMM;ConvDirectNaiveConvFwd:456.513,0,miopenConvolutionFwdAlgoDirect
128-256-512-3x3-128-256-512-1-1x1-1x1-1x1-0-NCHW-FP32-F=ConvBinWinogradRxSf2x3g1:0.662425,0,miopenConvolutionFwdAlgoWinograd;ConvBinWinogradRxSf3x2:1.21399,0,miopenConvolutionFwdAlgoWinograd;GemmFwdRest:2.42532,603979776,miopenConvolutionFwdAlgoGEMM;ConvDirectNaiveConvFwd:224.98,0,miopenConvolutionFwdAlgoDirect
256-256-512-1x1-128-256-512-1-0x0-1x1-1x1-0-NCHW-FP32-F=ConvBinWinogradRxSf2x3g1:1.31972,0,miopenConvolutionFwdAlgoWinograd;ConvBinWinogradRxSf3x2:0.621921,0,miopenConvolutionFwdAlgoWinograd;GemmFwd1x1_0_1:0.337409,0,miopenConvolutionFwdAlgoGEMM;ConvDirectNaiveConvFwd:56.5304,0,miopenConvolutionFwdAlgoDirect
128-256-512-3x3-3-256-512-1-1x1-1x1-1x1-0-NCHW-FP32-F=ConvBinWinogradRxSf2x3g1:0.153376,0,miopenConvolutionFwdAlgoWinograd;ConvBinWinogradRxSf3x2:0.261968,0,miopenConvolutionFwdAlgoWinograd;GemmFwdRest:2.37387,603979776,miopenConvolutionFwdAlgoGEMM;ConvDirectNaiveConvFwd:133.139,0,miopenConvolutionFwdAlgoDirect
16-32-32-3x3-512-32-32-1-1x1-1x1-1x1-0-NCHW-FP32-F=ConvBinWinogradRxSf2x3g1:0.0116482,0,miopenConvolutionFwdAlgoWinograd;ConvBinWinogradRxSf3x2:0.016592,0,miopenConvolutionFwdAlgoWinograd;GemmFwdRest:0.0255682,589824,miopenConvolutionFwdAlgoGEMM;ConvDirectNaiveConvFwd:0.655097,0,miopenConvolutionFwdAlgoDirect
512-32-32-3x3-512-32-32-1-1x1-1x1-1x1-0-NCHW-FP32-F=ConvBinWinogradRxSf2x3g1:0.107984,0,miopenConvolutionFwdAlgoWinograd;ConvBinWinogradRxSf3x2:0.206,0,miopenConvolutionFwdAlgoWinograd;GemmFwdRest:0.336855,18874368,miopenConvolutionFwdAlgoGEMM;ConvDirectNaiveConvFwd:21.5627,0,miopenConvolutionFwdAlgoDirect
512-32-32-1x1-512-32-32-1-0x0-1x1-1x1-0-NCHW-FP32-F=ConvBinWinogradRxSf2x3g1:0.105992,0,miopenConvolutionFwdAlgoWinograd;ConvBinWinogradRxSf3x2:0.0586962,0,miopenConvolutionFwdAlgoWinograd;GemmFwd1x1_0_1:0.0458722,0,miopenConvolutionFwdAlgoGEMM;ConvDirectNaiveConvFwd:2.7546,0,miopenConvolutionFwdAlgoDirect
512-128-128-3x3-256-128-128-1-1x1-1x1-1x1-0-NCHW-FP32-F=ConvBinWinogradRxSf2x3g1:0.663097,0,miopenConvolutionFwdAlgoWinograd;ConvBinWinogradRxSf3x2:1.07188,0,miopenConvolutionFwdAlgoWinograd;GemmFwdRest:1.95201,301989888,miopenConvolutionFwdAlgoGEMM;ConvDirectNaiveConvFwd:197.663,0,miopenConvolutionFwdAlgoDirect
256-128-128-3x3-256-128-128-1-1x1-1x1-1x1-0-NCHW-FP32-F=ConvBinWinogradRxSf2x3g1:0.292785,0,miopenConvolutionFwdAlgoWinograd;ConvBinWinogradRxSf3x2:0.519137,0,miopenConvolutionFwdAlgoWinograd;GemmFwdRest:0.94985,150994944,miopenConvolutionFwdAlgoGEMM;ConvDirectNaiveConvFwd:98.176,0,miopenConvolutionFwdAlgoDirect
512-128-128-1x1-256-128-128-1-0x0-1x1-1x1-0-NCHW-FP32-F=ConvBinWinogradRxSf2x3g1:0.559865,0,miopenConvolutionFwdAlgoWinograd;ConvBinWinogradRxSf3x2:0.26972,0,miopenConvolutionFwdAlgoWinograd;GemmFwd1x1_0_1:0.193056,0,miopenConvolutionFwdAlgoGEMM;ConvDirectNaiveConvFwd:26.2138,0,miopenConvolutionFwdAlgoDirect
256-256-256-3x3-128-256-256-1-1x1-1x1-1x1-0-NCHW-FP32-F=ConvBinWinogradRxSf2x3g1:0.656809,0,miopenConvolutionFwdAlgoWinograd;ConvBinWinogradRxSf3x2:1.08823,0,miopenConvolutionFwdAlgoWinograd;GemmFwdRest:2.61764,603979776,miopenConvolutionFwdAlgoGEMM;ConvDirectNaiveConvFwd:226.811,0,miopenConvolutionFwdAlgoDirect
128-256-256-3x3-128-256-256-1-1x1-1x1-1x1-0-NCHW-FP32-F=ConvBinWinogradRxSf2x3g1:0.322057,0,miopenConvolutionFwdAlgoWinograd;ConvBinWinogradRxSf3x2:0.533985,0,miopenConvolutionFwdAlgoWinograd;GemmFwdRest:1.32931,301989888,miopenConvolutionFwdAlgoGEMM;ConvDirectNaiveConvFwd:111.382,0,miopenConvolutionFwdAlgoDirect
256-256-256-1x1-128-256-256-1-0x0-1x1-1x1-0-NCHW-FP32-F=ConvBinWinogradRxSf2x3g1:0.572865,0,miopenConvolutionFwdAlgoWinograd;ConvBinWinogradRxSf3x2:0.282009,0,miopenConvolutionFwdAlgoWinograd;GemmFwd1x1_0_1:0.18208,0,miopenConvolutionFwdAlgoGEMM;ConvDirectNaiveConvFwd:28.2362,0,miopenConvolutionFwdAlgoDirect
128-256-256-3x3-3-256-256-1-1x1-1x1-1x1-0-NCHW-FP32-F=ConvBinWinogradRxSf2x3g1:0.0871442,0,miopenConvolutionFwdAlgoWinograd;ConvBinWinogradRxSf3x2:0.160032,0,miopenConvolutionFwdAlgoWinograd;GemmFwdRest:0.900217,301989888,miopenConvolutionFwdAlgoGEMM;ConvDirectNaiveConvFwd:60.8837,0,miopenConvolutionFwdAlgoDirect
